{
  "domain": "enemy_templates",
  "entries": [
    {
      "attack_equipment_item_id": "",
      "attribute_overrides": {
        "action_points": 2,
        "mp_max": 0
      },
      "base_attribute_overrides": {
        "agility": 15,
        "constitution": 14,
        "intelligence": 6,
        "perception": 10,
        "strength": 14,
        "willpower": 8
      },
      "battle_equipment_entries": [],
      "battle_sprite_asset_id": "",
      "body_size": 2,
      "brain_id": "melee_aggressor",
      "cognition_kind": "sapient",
      "creature_level": 4,
      "challenge_rating": 3,
      "damage_resistances": {},
      "display_name": "\u98DF\u5C38\u9B3C",
      "drop_entries": [
        {
          "drop_entry_id": "ghoul_gland",
          "drop_type": "item",
          "item_id": "antidote_herb",
          "quantity": 1
        }
      ],
      "enemy_count": 1,
      "generated_core_skill_count": 0,
      "hit_die_sides": 8,
      "initial_state_id": "engage",
      "natural_weapon_attack_range": 1,
      "natural_weapon_damage_tag": "",
      "save_advantage_tags": [],
      "save_disadvantage_tags": [],
      "save_immunity_tags": [
        "sleep",
        "charm",
        "poison"
      ],
      "skill_ids": [
        "basic_attack"
      ],
      "skill_level_map": {},
      "tags": [
        "undead",
        "ghoul",
        "beast",
        "claw"
      ],
      "target_rank": "normal",
      "template_id": "ghoul"
    }
  ],
  "family": "ghoul",
  "schema": 1,
  "templates": {}
}
