{
  "domain": "enemy_templates",
  "entries": [
    {
      "attack_equipment_item_id": "iron_morningstar",
      "attribute_overrides": {
        "action_points": 2,
        "mp_max": 0
      },
      "base_attribute_overrides": {
        "agility": 14,
        "constitution": 13,
        "intelligence": 8,
        "perception": 10,
        "strength": 15,
        "willpower": 9
      },
      "battle_equipment_entries": [
        {
          "current_durability": 56,
          "item_id": "leather_jerkin",
          "rarity": 0,
          "slot_id": "body"
        }
      ],
      "battle_sprite_asset_id": "",
      "body_size": 2,
      "brain_id": "melee_aggressor",
      "cognition_kind": "sapient",
      "creature_level": 3,
      "challenge_rating": 3,
      "damage_resistances": {},
      "display_name": "\u718A\u5730\u7CBE",
      "drop_entries": [
        {
          "drop_entry_id": "bugbear_whetstone",
          "drop_type": "item",
          "item_id": "whetstone",
          "quantity": 1
        }
      ],
      "enemy_count": 1,
      "generated_core_skill_count": 0,
      "hit_die_sides": 8,
      "initial_state_id": "engage",
      "natural_weapon_attack_range": 1,
      "natural_weapon_damage_tag": "",
      "save_advantage_tags": [],
      "save_disadvantage_tags": [],
      "save_immunity_tags": [],
      "skill_ids": [
        "warrior_heavy_strike"
      ],
      "skill_level_map": {},
      "tags": [
        "humanoid",
        "goblinoid",
        "bugbear"
      ],
      "target_rank": "normal",
      "template_id": "bugbear"
    }
  ],
  "family": "bugbear",
  "schema": 1,
  "templates": {}
}
