{
  "domain": "enemy_templates",
  "entries": [
    {
      "attack_equipment_item_id": "watchman_mace",
      "attribute_overrides": {
        "action_points": 2,
        "deflection_bonus": 4,
        "mp_max": 120
      },
      "base_attribute_overrides": {
        "agility": 12,
        "constitution": 12,
        "intelligence": 16,
        "perception": 14,
        "strength": 8,
        "willpower": 15
      },
      "battle_equipment_entries": [],
      "battle_sprite_asset_id": "",
      "body_size": 2,
      "brain_id": "healer_controller",
      "cognition_kind": "sapient",
      "creature_level": 4,
      "challenge_rating": 4,
      "damage_resistances": {
        "fire": "double",
        "freeze": "half",
        "physical_pierce": "half"
      },
      "display_name": "\u96FE\u6CBC\u7EC7\u5492\u8005",
      "drop_entries": [
        {
          "drop_entry_id": "weaver_herb",
          "drop_type": "item",
          "item_id": "moonfern_sample",
          "quantity": 2
        }
      ],
      "enemy_count": 1,
      "generated_core_skill_count": 0,
      "hit_die_sides": 6,
      "initial_state_id": "pressure",
      "natural_weapon_attack_range": 1,
      "natural_weapon_damage_tag": "",
      "save_advantage_tags": [
        "illusion",
        "temporal"
      ],
      "save_disadvantage_tags": [],
      "save_immunity_tags": [],
      "skill_ids": [
        "mage_temporal_rewind",
        "mage_glacial_prison",
        "mage_ice_lance"
      ],
      "skill_level_map": {
        "mage_glacial_prison": 3,
        "mage_ice_lance": 3,
        "mage_temporal_rewind": 3
      },
      "tags": [
        "mist",
        "weaver",
        "magical_beast"
      ],
      "target_rank": "elite",
      "template_id": "mist_weaver"
    }
  ],
  "family": "mist_weaver",
  "schema": 1,
  "templates": {}
}
