{
  "domain": "enemy_templates",
  "entries": [
    {
      "attack_equipment_item_id": "",
      "attribute_overrides": {
        "action_points": 2,
        "deflection_bonus": 4,
        "mp_max": 120
      },
      "base_attribute_overrides": {
        "agility": 12,
        "constitution": 12,
        "intelligence": 12,
        "perception": 14,
        "strength": 10,
        "willpower": 13
      },
      "battle_equipment_entries": [],
      "battle_sprite_asset_id": "",
      "body_size": 2,
      "brain_id": "ranged_controller",
      "cognition_kind": "instinctive",
      "creature_level": 3,
      "challenge_rating": 4,
      "damage_resistances": {
        "fire": "double",
        "physical_pierce": "half"
      },
      "display_name": "\u96FE\u6CBC\u5F02\u517D",
      "drop_entries": [
        {
          "drop_entry_id": "mist_herb",
          "drop_type": "item",
          "item_id": "moonfern_sample",
          "quantity": 1
        }
      ],
      "enemy_count": 2,
      "generated_core_skill_count": 0,
      "hit_die_sides": 8,
      "initial_state_id": "pressure",
      "natural_weapon_attack_range": 1,
      "natural_weapon_damage_tag": "",
      "save_advantage_tags": [
        "illusion",
        "temporal"
      ],
      "save_disadvantage_tags": [],
      "save_immunity_tags": [],
      "skill_ids": [
        "mage_fireball",
        "mage_ice_lance",
        "mage_temporal_rewind"
      ],
      "skill_level_map": {
        "mage_fireball": 3,
        "mage_ice_lance": 3,
        "mage_temporal_rewind": 3
      },
      "tags": [
        "beast",
        "mist",
        "magical_beast"
      ],
      "target_rank": "normal",
      "template_id": "mist_beast"
    }
  ],
  "family": "mist_beast",
  "schema": 1,
  "templates": {}
}
