{
  "domain": "enemy_templates",
  "entries": [
    {
      "attack_equipment_item_id": "militia_axe",
      "attribute_overrides": {
        "action_points": 2,
        "mp_max": 0
      },
      "base_attribute_overrides": {
        "agility": 12,
        "constitution": 13,
        "intelligence": 8,
        "perception": 11,
        "strength": 14,
        "willpower": 9
      },
      "battle_equipment_entries": [
        {
          "current_durability": 56,
          "item_id": "leather_jerkin",
          "rarity": 0,
          "slot_id": "body"
        }
      ],
      "battle_sprite_asset_id": "",
      "body_size": 2,
      "brain_id": "melee_aggressor",
      "cognition_kind": "sapient",
      "creature_level": 2,
      "challenge_rating": 2,
      "damage_resistances": {},
      "display_name": "\u8C7A\u72FC\u4EBA\u730E\u624B",
      "drop_entries": [
        {
          "drop_entry_id": "gnoll_hide",
          "drop_type": "item",
          "item_id": "beast_hide",
          "quantity": 1
        }
      ],
      "enemy_count": 2,
      "generated_core_skill_count": 0,
      "hit_die_sides": 8,
      "initial_state_id": "engage",
      "natural_weapon_attack_range": 1,
      "natural_weapon_damage_tag": "",
      "save_advantage_tags": [],
      "save_disadvantage_tags": [],
      "save_immunity_tags": [],
      "skill_ids": [
        "basic_attack"
      ],
      "skill_level_map": {},
      "tags": [
        "humanoid",
        "gnoll"
      ],
      "target_rank": "normal",
      "template_id": "gnoll_hunter"
    }
  ],
  "family": "gnoll_hunter",
  "schema": 1,
  "templates": {}
}
