{
  "domain": "enemy_templates",
  "entries": [
    {
      "attack_equipment_item_id": "bronze_sword",
      "attribute_overrides": {
        "action_points": 2,
        "mp_max": 0
      },
      "base_attribute_overrides": {
        "agility": 11,
        "constitution": 13,
        "intelligence": 4,
        "perception": 8,
        "strength": 13,
        "willpower": 10
      },
      "battle_equipment_entries": [
        {
          "current_durability": 56,
          "item_id": "iron_scale_mail",
          "rarity": 0,
          "slot_id": "body"
        }
      ],
      "battle_sprite_asset_id": "",
      "body_size": 2,
      "brain_id": "melee_aggressor",
      "cognition_kind": "mindless",
      "creature_level": 2,
      "challenge_rating": 2,
      "damage_resistances": {
        "physical_blunt": "double",
        "physical_pierce": "half"
      },
      "display_name": "\u9AB7\u9AC5\u536B\u58EB",
      "drop_entries": [
        {
          "drop_entry_id": "skeleton_blade",
          "drop_type": "random_equipment",
          "item_id": "bronze_sword",
          "quantity": 1
        }
      ],
      "enemy_count": 1,
      "generated_core_skill_count": 0,
      "hit_die_sides": 8,
      "initial_state_id": "engage",
      "natural_weapon_attack_range": 1,
      "natural_weapon_damage_tag": "",
      "save_advantage_tags": [],
      "save_disadvantage_tags": [],
      "save_immunity_tags": [
        "sleep",
        "charm",
        "poison"
      ],
      "skill_ids": [
        "basic_attack"
      ],
      "skill_level_map": {},
      "tags": [
        "undead",
        "skeleton"
      ],
      "target_rank": "normal",
      "template_id": "skeleton_soldier"
    }
  ],
  "family": "skeleton_soldier",
  "schema": 1,
  "templates": {}
}
