{
  "domain": "enemy_templates",
  "entries": [
    {
      "attack_equipment_item_id": "militia_spear",
      "attribute_overrides": {
        "action_points": 2,
        "deflection_bonus": 3,
        "mp_max": 0
      },
      "base_attribute_overrides": {
        "agility": 11,
        "constitution": 14,
        "intelligence": 10,
        "perception": 11,
        "strength": 15,
        "willpower": 11
      },
      "battle_equipment_entries": [
        {
          "current_durability": 84,
          "item_id": "iron_scale_mail",
          "rarity": 1,
          "slot_id": "body"
        }
      ],
      "battle_sprite_asset_id": "",
      "body_size": 2,
      "brain_id": "frontline_bulwark",
      "cognition_kind": "sapient",
      "creature_level": 4,
      "challenge_rating": 4,
      "damage_resistances": {},
      "display_name": "\u5927\u54E5\u5E03\u6797\u961F\u957F",
      "drop_entries": [
        {
          "drop_entry_id": "hobgoblin_spear",
          "drop_type": "random_equipment",
          "item_id": "militia_spear",
          "quantity": 1
        }
      ],
      "enemy_count": 1,
      "generated_core_skill_count": 0,
      "hit_die_sides": 8,
      "initial_state_id": "engage",
      "natural_weapon_attack_range": 1,
      "natural_weapon_damage_tag": "",
      "save_advantage_tags": [],
      "save_disadvantage_tags": [],
      "save_immunity_tags": [],
      "skill_ids": [
        "warrior_shield_bash",
        "warrior_taunt",
        "warrior_guard"
      ],
      "skill_level_map": {},
      "tags": [
        "humanoid",
        "goblinoid"
      ],
      "target_rank": "elite",
      "template_id": "hobgoblin_captain"
    }
  ],
  "family": "hobgoblin_captain",
  "schema": 1,
  "templates": {}
}
