{
  "domain": "enemy_templates",
  "entries": [
    {
      "attack_equipment_item_id": "",
      "attribute_overrides": {
        "action_points": 2,
        "mp_max": 120
      },
      "base_attribute_overrides": {
        "agility": 14,
        "constitution": 10,
        "intelligence": 10,
        "perception": 12,
        "strength": 6,
        "willpower": 13
      },
      "battle_equipment_entries": [],
      "battle_sprite_asset_id": "",
      "body_size": 2,
      "brain_id": "ranged_controller",
      "cognition_kind": "sapient",
      "creature_level": 5,
      "challenge_rating": 4,
      "damage_resistances": {
        "negative_energy": "immune",
        "physical_blunt": "half",
        "physical_pierce": "half",
        "physical_slash": "half",
        "radiant": "double"
      },
      "display_name": "\u6028\u7075",
      "drop_entries": [
        {
          "drop_entry_id": "specter_fern",
          "drop_type": "item",
          "item_id": "moonfern_sample",
          "quantity": 1
        }
      ],
      "enemy_count": 1,
      "generated_core_skill_count": 0,
      "hit_die_sides": 6,
      "initial_state_id": "pressure",
      "natural_weapon_attack_range": 1,
      "natural_weapon_damage_tag": "physical_blunt",
      "save_advantage_tags": [],
      "save_disadvantage_tags": [],
      "save_immunity_tags": [
        "sleep",
        "charm",
        "poison",
        "frightened"
      ],
      "skill_ids": [
        "mage_ice_lance"
      ],
      "skill_level_map": {
        "mage_ice_lance": 3
      },
      "tags": [
        "undead",
        "specter",
        "incorporeal",
        "beast"
      ],
      "target_rank": "normal",
      "template_id": "specter"
    }
  ],
  "family": "specter",
  "schema": 1,
  "templates": {}
}
